Pin Default
Codec: Realtek ALC892
Address: 0
AFG Function Id: 0x1 (unsol 1)
Vendor Id: 0x10ec0892
Subsystem Id: 0x15586555
Revision Id: 0x100302

Pin Default 0x4010c000: [N/A] Speaker at Ext N/A    Conn = Unknown, Color = UNKNOWN
Pin Default 0x90a60150: [Fixed] Mic at Int N/A    Conn = Digital, Color = Unknown
Pin Default 0x90170110: [Fixed] Speaker at Int N/A    Conn = Analog, Color = Unknown
Pin Default 0x411111f0: [N/A] Speaker at Ext Rear    Conn = 1/8, Color = Black
Pin Default 0x411111f0: [N/A] Speaker at Ext Rear    Conn = 1/8, Color = Black
Pin Default 0x01011020: [Jack] Line Out at Ext Rear    Conn = 1/8, Color = Black
Pin Default 0x01a11060: [Jack] Mic at Ext Rear    Conn = 1/8, Color = Black
Pin Default 0x411111f0: [N/A] Speaker at Ext Rear    Conn = 1/8, Color = Black
Pin Default 0x411111f0: [N/A] Speaker at Ext Rear    Conn = 1/8, Color = Black
Pin Default 0x01011030: [Jack] Line Out at Ext Rear    Conn = 1/8, Color = Black
Pin Default 0x411111f0: [N/A] Speaker at Ext Rear    Conn = 1/8, Color = Black
Pin Default 0x40341429: [N/A] CD at Ext N/A    Conn = RCA, Color = Black
Pin Default 0x01441140: [Jack] SPDIF Out at Ext Rear    Conn = RCA, Color = Black
Pin Default 0x411111f0: [N/A] Speaker at Ext Rear    Conn = 1/8, Color = Black


   Jack   Color  Description                  Node     PinDefault             Modified Verbs            PinModified MyModified
-----------------------------------------------------------------------------------------------------------------------------
Unknown UNKNOWN  Speaker at Ext N/A          17 0x11   0x4010c000   01171c00 01171dc0 01171e10 01171f40 0x4010c000 0x4010c000
Digital Unknown  Mic at Int N/A              18 0x12   0x90a60150   01271c50 01271d00 01271ea6 01271f90 0x90a60050 0x90a60150
				 Speaker at Int N/A    		 20 0x14   0x90170110	01471c70 01471d00 01471e17 01471f90 0x90170070 0x90170170
    1/8   Black  Line Out at Ext Rear        23 0x17   0x01011020   01771c20 01771d10 01771e01 01771f01 0x01011020 0x01011020
 				 Mic at Ext Rear    		 24 0x18   0x01A11060 	01871c60 01871d10 01871ea1 01871f01 0x01a11060 0x01a11060
				 Line Out at Ext Rear   	 27 0x1b   0x01011030 	01b71c30 01b71d10 01b71e01 01b71f01 0x01011030 0x01011030
    RCA   Black  CD at Ext N/A               29 0x1d   0x40341429   01d71c80 01d71d10 01d71e34 01d71f40 0x40341080 0x40341080
    RCA   Black  SPDIF Out at Ext Rear       30 0x1e   0x01441140   01e71c40 01e71d10 01e71e44 01e71f01 0x01441040 0x01441040


remove N/A
   Jack   Color  Description                  Node     PinDefault             Modified Verbs            PinModified MyModified
-----------------------------------------------------------------------------------------------------------------------------
Unknown UNKNOWN  Speaker at Ext N/A          17 0x11   0x4010c000   01171c00 01171dc0 01171e10 01171f40 0x4010c000 0x4010c000
Digital Unknown  Mic at Int N/A              18 0x12   0x90a60150   01271c50 01271d00 01271ea6 01271f90 0x90a60050 0x90a60150
				 Speaker at Int N/A    		 20 0x14   0x90170110	01471c70 01471d00 01471e17 01471f90 0x90170070 0x90170170
    1/8   Black  Line Out at Ext Rear        23 0x17   0x01011020   01771c20 01771d10 01771e01 01771f01 0x01011020 0x01011020
 				 Mic at Ext Rear    		 24 0x18   0x01A11060 	01871c60 01871d10 01871ea1 01871f01 0x01a11060 0x01a11060
				 Line Out at Ext Rear   	 27 0x1b   0x01011030 	01b71c30 01b71d10 01b71e01 01b71f01 0x01011030 0x01011030
    RCA   Black  CD at Ext N/A               29 0x1d   0x40341429   01d71c80 01d71d10 01d71e34 01d71f40 0x40341080 0x40341080
    RCA   Black  SPDIF Out at Ext Rear       30 0x1e   0x01441140   01e71c40 01e71d10 01e71e44 01e71f01 0x01441040 0x01441040
